Date,Party_Name,GSTIN,Taxable_Value,GST_Rate,CGST,SGST,IGST,Total,Narration,Is_Fraud
2025-04-13,Barad-Andra,23hMCbG0864Q2ZA,482881.78,12,28972.9068,28972.9068,0.0,540827.5936,Being goods sold to Barad-Andra Inv No 405,0
2025-06-26,Varughese Ltd,26SFYZx0182A2ZC,365766.06,28,51207.248400000004,51207.248400000004,0.0,468180.55679999996,Being goods sold to Varughese Ltd Inv No 491,0
2025-03-11,"Kibe, Choudhary and Arya",19gRYBK2420S4ZA,432427.34,18,0.0,0.0,77836.9212,510264.2612,"Being goods sold to Kibe, Choudhary and Arya Inv No 780",0
2025-10-05,"Chaudhry, Shanker and Kapur",28eDxtu8631H7ZB,403457.97,28,56484.1158,56484.1158,0.0,516426.20160000003,"Being goods sold to Chaudhry, Shanker and Kapur Inv No 564",0
2026-02-22,Bhatia Ltd,36xhZwX3506h5ZC,50000.0,18,0.0,0.0,9000.0,59000.0,Urgent payment cash,1
2025-08-26,Dora-Munshi,10sjXPq5984r3ZB,82974.81,12,4978.4886,4978.4886,0.0,92931.78719999999,Being goods sold to Dora-Munshi Inv No 336,0
2025-06-21,Badal Ltd,29YyUUJ3981A5ZC,275483.85,5,0.0,0.0,13774.1925,289258.0425,Being goods sold to Badal Ltd Inv No 536,0
2025-10-12,Sur-Raja,25LGEAr4426T1ZA,343514.07,28,0.0,0.0,96183.93960000001,439698.0096,Being goods sold to Sur-Raja Inv No 567,0
2025-09-20,"Hans, Shere and Shah",26eOfLv4642U7ZB,409391.66,18,36845.24939999999,36845.24939999999,0.0,483082.1587999999,"Being goods sold to Hans, Shere and Shah Inv No 130",0
2025-05-25,Prakash-Goda,13lZRuv6216s6ZB,361965.4,12,0.0,0.0,43435.848,405401.248,Being goods sold to Prakash-Goda Inv No 880,0
2025-10-05,Apte-Butala,26GfMCv9805W9ZA,134004.91,12,8040.2946,8040.2946,0.0,150085.4992,Being goods sold to Apte-Butala Inv No 669,0
2026-01-07,"Sura, Dugar and Kala",24gCYLM0191V8ZA,297623.11,0,0.0,0.0,0.0,297623.11,"Being goods sold to Sura, Dugar and Kala Inv No 963",0
2025-05-18,Swaminathan-Shankar,34KYvrH5249M8ZA,211829.96,28,0.0,0.0,59312.3888,271142.3488,Being goods sold to Swaminathan-Shankar Inv No 319,0
2025-07-21,"Nayar, Mital and Padmanabhan",23oezkc6634c8ZB,328125.95,5,0.0,0.0,16406.2975,344532.2475,"Being goods sold to Nayar, Mital and Padmanabhan Inv No 631",0
2025-07-14,Dugar-Kata,34jfDaB0189N6ZB,440266.62,5,11006.665500000001,11006.665500000001,0.0,462279.951,Being goods sold to Dugar-Kata Inv No 706,0
2025-12-31,Ram PLC,13pFRLn4290n1ZC,281745.68,0,0.0,0.0,0.0,281745.68,Being goods sold to Ram PLC Inv No 280,0
2025-09-30,"Sodhi, Aurora and Kant",36ACYQk4424Y2ZB,484652.17,0,0.0,0.0,0.0,484652.17,"Being goods sold to Sodhi, Aurora and Kant Inv No 579",0
2025-07-26,Mander and Sons,16lRGMb9098q4ZB,191516.96,5,0.0,0.0,9575.848,201092.808,Being goods sold to Mander and Sons Inv No 816,0
2025-09-10,Kunda-Pau,25blvyW1265k5ZC,231936.46,18,20874.2814,20874.2814,0.0,273685.0228,Being goods sold to Kunda-Pau Inv No 932,0
2025-05-07,"Oza, Chanda and Madan",37MlxPU5560m5ZA,340405.39,28,0.0,0.0,95313.50920000001,435718.89920000004,"Being goods sold to Oza, Chanda and Madan Inv No 323",0
2025-06-24,Sankaran-Ganesh,10bKZPA1829y3ZC,92931.63,28,13010.428200000002,13010.428200000002,0.0,118952.4864,Being goods sold to Sankaran-Ganesh Inv No 116,0
2026-01-29,Sandal and Sons,15DpwSu7714j5ZA,51596.19,5,1289.9047500000001,1289.9047500000001,0.0,54175.999500000005,Being goods sold to Sandal and Sons Inv No 143,0
2025-04-04,Bhatt and Sons,13TOuPe6909T8ZB,64279.47,12,0.0,0.0,7713.5364,71993.0064,Being goods sold to Bhatt and Sons Inv No 598,0
2025-05-27,Gulati-Sarna,19ruLru0298Z7ZB,210420.71,0,0.0,0.0,0.0,210420.71,Being goods sold to Gulati-Sarna Inv No 734,0
2025-11-30,Deshpande Group,15WWwmw0068r6ZB,298538.46,0,0.0,0.0,0.0,298538.46,Being goods sold to Deshpande Group Inv No 533,0
2025-04-01,Chawla-Sengupta,30uKxwy0742i5ZA,61330.06,5,1533.2515,1533.2515,0.0,64396.562999999995,Being goods sold to Chawla-Sengupta Inv No 846,0
2025-04-28,Khanna-Wali,18iCyKc3156u3ZC,318714.31,12,19122.8586,19122.8586,0.0,356960.02719999995,Being goods sold to Khanna-Wali Inv No 945,0
2025-06-22,"Shanker, Iyengar and Shenoy",24Kxbsf1238e5ZC,378897.98,12,0.0,0.0,45467.7576,424365.7376,"Being goods sold to Shanker, Iyengar and Shenoy Inv No 180",0
2025-09-08,Sekhon Group,13SHdZe6770I5ZC,10569.52,28,1479.7328000000002,1479.7328000000002,0.0,13528.9856,Being goods sold to Sekhon Group Inv No 107,0
2025-09-03,"Banik, Sethi and Gala",27VOrqh9523L7ZB,498760.75,28,69826.505,69826.505,0.0,638413.76,"Being goods sold to Banik, Sethi and Gala Inv No 514",0
2026-02-05,Pai-Shenoy,33KNqtX4059O8ZA,404832.39,28,0.0,0.0,56676.534600000006,461508.9246,GST Calculation Error,1
2025-07-17,Shere Ltd,35EMlfj3498w1ZB,177430.41,0,0.0,0.0,0.0,177430.41,Being goods sold to Shere Ltd Inv No 758,0
2026-01-28,Bhavsar-Warrior,34enBue6324d8ZA,296871.69,0,0.0,0.0,0.0,296871.69,Being goods sold to Bhavsar-Warrior Inv No 958,0
2025-05-25,"Gour, Din and Yogi",24feCbO7270c5ZA,112110.27,5,2802.7567500000005,2802.7567500000005,0.0,117715.7835,"Being goods sold to Gour, Din and Yogi Inv No 821",0
2026-01-15,"Goel, Gour and Sachdeva",20WSxdB0277D1ZC,232218.2,28,32510.548000000006,32510.548000000006,0.0,297239.29600000003,"Being goods sold to Goel, Gour and Sachdeva Inv No 296",0
2026-01-02,"Shere, Dave and Bhatnagar",22yyzjd1182l1ZB,333558.37,12,0.0,0.0,40027.0044,373585.3744,"Being goods sold to Shere, Dave and Bhatnagar Inv No 822",0
2026-01-16,Palla PLC,27siLvK9723z5ZC,30593.96,0,0.0,0.0,0.0,30593.96,Being goods sold to Palla PLC Inv No 236,0
2025-11-04,Venkataraman-Ratta,31xpUht4839b3ZC,336147.73,18,30253.2957,30253.2957,0.0,396654.3214,Being goods sold to Venkataraman-Ratta Inv No 964,0
2025-10-28,"Krishna, Arora and Brahmbhatt",24ZWNis1998G6ZB,349829.35,28,48976.109000000004,48976.109000000004,0.0,447781.56799999997,"Being goods sold to Krishna, Arora and Brahmbhatt Inv No 701",0
2025-06-30,"Parmer, Tata and Thaker",22ckYAl5186q1ZB,276482.69,5,6912.06725,6912.06725,0.0,290306.82450000005,"Being goods sold to Parmer, Tata and Thaker Inv No 431",0
2025-03-07,Vora-Kaur,19HZSRr1017y1ZB,459021.56,12,0.0,0.0,55082.587199999994,514104.1472,Being goods sold to Vora-Kaur Inv No 256,0
2026-01-09,Hans LLC,37NFJuj6700U2ZA,47026.42,28,6583.6988,6583.6988,0.0,60193.817599999995,Being goods sold to Hans LLC Inv No 189,0
2025-11-02,"Gopal, Misra and Bawa",13VpEGB0713C4ZA,11316.33,5,0.0,0.0,565.8165,11882.1465,"Being goods sold to Gopal, Misra and Bawa Inv No 495",0
2025-05-27,Das and Sons,13jMWnJ4585f5ZB,55171.34,5,0.0,0.0,2758.567,57929.907,Being goods sold to Das and Sons Inv No 376,0
2025-08-26,Seth Ltd,24IZkJY6219b3ZA,21403.6,28,2996.504,2996.504,0.0,27396.608,Being goods sold to Seth Ltd Inv No 811,0
2025-06-19,Varghese LLC,38hGWrc3797I5ZC,340660.59,18,0.0,0.0,61318.906200000005,401979.49620000005,Being goods sold to Varghese LLC Inv No 259,0
2025-10-13,"Vohra, Nadig and Pant",12kddpX3008b6ZB,155199.62,0,0.0,0.0,0.0,155199.62,"Being goods sold to Vohra, Nadig and Pant Inv No 302",0
2025-04-22,Cherian-Balay,17DSsoy6830f3ZC,99876.36,18,8988.8724,8988.8724,0.0,117854.1048,Being goods sold to Cherian-Balay Inv No 734,0
2025-04-19,"Vora, Kota and Sehgal",33xtExZ5618R6ZA,465062.42,5,11626.5605,11626.5605,0.0,488315.541,"Being goods sold to Vora, Kota and Sehgal Inv No 317",0
2025-08-23,Grewal Group,16TbFYW2651q7ZA,454132.55,28,0.0,0.0,127157.11400000002,581289.664,Being goods sold to Grewal Group Inv No 242,0
2025-07-05,Mitra Ltd,13bJudj4639x7ZB,30534.2,12,1832.052,1832.052,0.0,34198.304000000004,Being goods sold to Mitra Ltd Inv No 255,0
2025-11-23,Personal - Nidhi,18IOogd3916r7ZB,294276.86,18,0.0,0.0,52969.8348,347246.6948,Adjustment,1
2025-07-01,"Chana, Walia and Chahal",27DBiuj8956i3ZB,114036.43,0,0.0,0.0,0.0,114036.43,"Being goods sold to Chana, Walia and Chahal Inv No 208",0
2025-08-14,Khalsa LLC,25AjWPT5356u4ZB,453553.59,28,0.0,0.0,126995.00520000001,580548.5952000001,Being goods sold to Khalsa LLC Inv No 228,0
2026-01-07,"Dyal, Varughese and Tiwari",32MTrYF0303L4ZA,152760.06,12,9165.6036,9165.6036,0.0,171091.2672,"Being goods sold to Dyal, Varughese and Tiwari Inv No 858",0
2025-06-05,Sarna-Bawa,27NJwGs5339W7ZA,191330.94,28,26786.3316,26786.3316,0.0,244903.6032,Being goods sold to Sarna-Bawa Inv No 528,0
2025-06-17,Choudhry and Sons,11JzgQs6033P5ZA,379317.56,5,0.0,0.0,9482.939,388800.499,GST Calculation Error,1
2025-08-06,Bhavsar-Patla,30vSvGr8879e1ZC,51483.77,18,0.0,0.0,9267.078599999999,60750.8486,Being goods sold to Bhavsar-Patla Inv No 986,0
2025-07-20,Lata Inc,31bKzZD3026P8ZC,209186.78,0,0.0,0.0,0.0,209186.78,Being goods sold to Lata Inc Inv No 952,0
2025-06-13,Agrawal-Koshy,16kkhot7940W3ZB,473825.74,28,0.0,0.0,132671.2072,606496.9472,Being goods sold to Agrawal-Koshy Inv No 638,0
2025-09-11,"Ramachandran, Keer and Chanda",16bfkwy8567N1ZA,303614.33,28,42506.0062,42506.0062,0.0,388626.3424,"Being goods sold to Ramachandran, Keer and Chanda Inv No 186",0
2025-07-01,Thaman-Jain,30eWdAK7976P5ZA,302398.28,28,0.0,0.0,84671.51840000002,387069.7984,Being goods sold to Thaman-Jain Inv No 794,0
2026-01-16,Devan PLC,27zkeNh2823t4ZA,370674.49,12,0.0,0.0,44480.938799999996,415155.4288,Being goods sold to Devan PLC Inv No 945,0
2025-05-29,Dayal Inc,30FSrtR6076g6ZB,449466.28,18,40451.9652,40451.9652,0.0,530370.2104,Being goods sold to Dayal Inc Inv No 708,0
2026-02-16,Raval-Issac,16Ymimf0223O3ZB,35201.99,0,0.0,0.0,0.0,35201.99,Being goods sold to Raval-Issac Inv No 666,0
2025-04-29,Dixit-Ranganathan,11siclv3164x8ZA,457723.22,18,41195.089799999994,41195.089799999994,0.0,540113.3996,Being goods sold to Dixit-Ranganathan Inv No 279,0
2026-02-18,"Parekh, Vyas and Khalsa",23AnlUS9139A9ZB,241144.23,18,10851.49035,10851.49035,0.0,262847.2107,GST Calculation Error,1
2025-04-28,Devi-Mann,31BNZea6883t5ZC,467613.37,0,0.0,0.0,0.0,467613.37,Being goods sold to Devi-Mann Inv No 241,0
2025-05-04,"Gupta, Mutti and Chakrabarti",30HsOiL8197V5ZA,206279.2,5,5156.9800000000005,5156.9800000000005,0.0,216593.16000000003,"Being goods sold to Gupta, Mutti and Chakrabarti Inv No 131",0
2025-03-03,Nagi-Ramanathan,23dxJTL9652M2ZA,185304.75,18,16677.427499999998,16677.427499999998,0.0,218659.60499999998,Being goods sold to Nagi-Ramanathan Inv No 837,0
2025-09-20,Bhat-Babu,10NQeRG0299l3ZA,340441.11,5,8511.02775,8511.02775,0.0,357463.1655,Being goods sold to Bhat-Babu Inv No 272,0
2025-09-08,Oommen-Kuruvilla,24iJORu7254d4ZB,407333.71,28,0.0,0.0,114053.43880000002,521387.1488,Being goods sold to Oommen-Kuruvilla Inv No 499,0
2025-05-19,Barad-Bedi,21LGzcu9722x1ZC,196494.41,18,0.0,0.0,35368.9938,231863.4038,Being goods sold to Barad-Bedi Inv No 229,0
2025-06-13,Jani LLC,20PcUKo4135O8ZA,164558.31,0,0.0,0.0,0.0,164558.31,Being goods sold to Jani LLC Inv No 631,0
2025-10-01,"Hayre, Gour and Krishnan",23tQMEr3709g7ZA,164578.4,5,0.0,0.0,8228.92,172807.32,"Being goods sold to Hayre, Gour and Krishnan Inv No 302",0
2025-07-04,Shetty Inc,18IlWGu2995Y9ZA,487347.41,12,29240.844599999997,29240.844599999997,0.0,545829.0991999999,Being goods sold to Shetty Inc Inv No 741,0
2025-07-28,Bumb Ltd,21xAWCN4611p6ZB,137220.13,0,0.0,0.0,0.0,137220.13,Being goods sold to Bumb Ltd Inv No 839,0
2025-05-05,"Raval, Chhabra and Seth",31PjYuA0772i3ZB,277335.87,18,24960.2283,24960.2283,0.0,327256.32660000003,"Being goods sold to Raval, Chhabra and Seth Inv No 219",0
2025-07-11,"Mitra, Sankaran and Raja",11VEfUl0995l5ZB,276268.57,12,0.0,0.0,33152.2284,309420.7984,"Being goods sold to Mitra, Sankaran and Raja Inv No 305",0
2026-01-18,Venkataraman-Bhalla,13UHDGh6576M4ZA,373840.17,28,0.0,0.0,104675.2476,478515.4176,Being goods sold to Venkataraman-Bhalla Inv No 904,0
2025-12-10,Setty-Sankaran,30jQHzJ6814Q3ZB,28009.97,12,0.0,0.0,3361.1964,31371.166400000002,Being goods sold to Setty-Sankaran Inv No 384,0
2026-01-15,Sant-Muni,38EqDHf8007T5ZC,494171.59,18,44475.443100000004,44475.443100000004,0.0,583122.4762,Being goods sold to Sant-Muni Inv No 239,0
2025-08-30,Doshi PLC,10aBVas2007H7ZC,477666.07,18,0.0,0.0,85979.89259999999,563645.9626,Being goods sold to Doshi PLC Inv No 655,0
2026-01-27,Jain-Batra,17FVsNK8710X8ZB,427490.17,28,59848.6238,59848.6238,0.0,547187.4176,Being goods sold to Jain-Batra Inv No 432,0
2025-06-05,Sathe-Manne,33VvgMj6731c5ZC,292952.05,12,17577.123,17577.123,0.0,328106.29600000003,Being goods sold to Sathe-Manne Inv No 166,0
2025-06-27,Venkatesh-Krishnan,36jsfrz8030C6ZB,411229.85,28,0.0,0.0,115144.35800000001,526374.208,Being goods sold to Venkatesh-Krishnan Inv No 950,0
2025-09-09,Sandal PLC,21fMQSx9686H8ZA,246772.28,28,0.0,0.0,69096.2384,315868.5184,Being goods sold to Sandal PLC Inv No 436,0
2025-08-15,"Baral, Dara and Taneja",30bXpRV0874H2ZA,470590.76,5,11764.769,11764.769,0.0,494120.29799999995,"Being goods sold to Baral, Dara and Taneja Inv No 246",0
2025-06-27,Krishnan Group,24TPRol6742F8ZB,407130.75,5,0.0,0.0,20356.537500000002,427487.2875,Being goods sold to Krishnan Group Inv No 935,0
2025-05-08,Bir-Misra,23IpcCU8392U8ZA,249704.33,0,0.0,0.0,0.0,249704.33,Being goods sold to Bir-Misra Inv No 901,0
2025-07-23,Sood Inc,34btlJi4551Q9ZC,68504.25,5,0.0,0.0,3425.2125,71929.4625,Being goods sold to Sood Inc Inv No 136,0
2025-03-30,Personal - Megha,32ltCCW3101C8ZC,38463.91,18,3461.7519,3461.7519,0.0,45387.41380000001,Adjustment,1
2025-06-26,Goyal PLC,11YlHVq3145o3ZA,401107.13,12,0.0,0.0,48132.855599999995,449239.9856,Being goods sold to Goyal PLC Inv No 879,0
2026-02-21,Borde LLC,36ABwep5737O7ZA,366206.25,0,0.0,0.0,0.0,366206.25,Being goods sold to Borde LLC Inv No 191,0
2025-10-09,"Soman, Kar and Kapur",21AWEnN7326R7ZA,134628.54,18,0.0,0.0,24233.1372,158861.6772,"Being goods sold to Soman, Kar and Kapur Inv No 725",0
2026-02-18,Tata Inc,19IaWOd0080n4ZC,33754.16,12,0.0,0.0,4050.4992,37804.6592,Being goods sold to Tata Inc Inv No 547,0
2025-09-27,Chand-Mahajan,23envQc9135T6ZA,133414.24,12,8004.854399999999,8004.854399999999,0.0,149423.9488,Being goods sold to Chand-Mahajan Inv No 706,0
2026-01-28,Bail-Pandey,25crJjG9532j9ZC,198459.16,12,11907.5496,11907.5496,0.0,222274.2592,Being goods sold to Bail-Pandey Inv No 138,0
2025-06-26,Iyengar-Sankar,21eztSs1650Y3ZC,220265.72,28,0.0,0.0,61674.401600000005,281940.1216,Being goods sold to Iyengar-Sankar Inv No 533,0
2025-12-02,"Shanker, Vaidya and Nayak",15ybEMY8912B9ZA,235209.79,0,0.0,0.0,0.0,235209.79,"Being goods sold to Shanker, Vaidya and Nayak Inv No 286",0
2025-11-06,"Vasa, Mitter and Chakraborty",21flsrC4210p2ZA,14818.16,18,0.0,0.0,2667.2688,17485.4288,"Being goods sold to Vasa, Mitter and Chakraborty Inv No 801",0
2025-12-05,Doshi-Manne,26CFlpZ4834p1ZA,63973.79,12,0.0,0.0,7676.8548,71650.6448,Being goods sold to Doshi-Manne Inv No 869,0
2025-12-19,"Kurian, Prashad and Arora",18RckcE8418n9ZA,192195.8,28,0.0,0.0,53814.824,246010.62399999998,"Being goods sold to Kurian, Prashad and Arora Inv No 414",0
2025-04-26,Personal - Jonathan,25pNohx2566H5ZA,285102.13,18,25659.1917,25659.1917,0.0,336420.51340000005,Personal expense,1
2025-08-15,Bava Inc,17vygVe6202B6ZA,333601.44,0,0.0,0.0,0.0,333601.44,Being goods sold to Bava Inc Inv No 535,0
2026-02-09,Dewan-Kanda,32Urgri8460h8ZB,413256.14,5,10331.4035,10331.4035,0.0,433918.94700000004,Being goods sold to Dewan-Kanda Inv No 891,0
2026-02-23,Kannan-Vohra,32bHpVE5374W2ZC,387824.4,12,0.0,0.0,46538.928,434363.32800000004,Being goods sold to Kannan-Vohra Inv No 442,0
2025-09-22,Bhargava PLC,14zKjJH6991A8ZB,55426.49,28,7759.708600000001,7759.708600000001,0.0,70945.9072,Being goods sold to Bhargava PLC Inv No 788,0
2026-01-05,"Korpal, Chawla and Borra",38jJbyC6499c8ZA,299512.47,18,26956.122299999995,26956.122299999995,0.0,353424.71459999995,"Being goods sold to Korpal, Chawla and Borra Inv No 705",0
2025-04-25,Munshi LLC,33kQjFO2323F5ZA,64815.36,12,3888.9215999999997,3888.9215999999997,0.0,72593.2032,Being goods sold to Munshi LLC Inv No 822,0
2025-04-22,Barad Group,35BZIwk0834Z4ZB,154969.59,0,0.0,0.0,0.0,154969.59,Being goods sold to Barad Group Inv No 371,0
2025-12-20,"Chatterjee, Narayan and Lala",35QeOHo6024r4ZA,34917.2,12,2095.0319999999997,2095.0319999999997,0.0,39107.263999999996,"Being goods sold to Chatterjee, Narayan and Lala Inv No 723",0
2026-02-04,Ben-Lata,24qazrC5779W1ZC,293688.54,12,17621.3124,17621.3124,0.0,328931.16479999997,Being goods sold to Ben-Lata Inv No 810,0
2025-07-04,Bath PLC,25Spsif1262t6ZB,318577.86,18,28672.0074,28672.0074,0.0,375921.8748,Being goods sold to Bath PLC Inv No 596,0
2025-08-23,Dixit Group,32RFAmG0663R8ZC,36629.15,28,5128.081000000001,5128.081000000001,0.0,46885.312,Being goods sold to Dixit Group Inv No 271,0
2025-12-25,"Kohli, Murty and Dada",16IfIat1693D5ZB,127789.9,28,17890.586,17890.586,0.0,163571.07200000001,"Being goods sold to Kohli, Murty and Dada Inv No 133",0
2025-05-07,Bumb PLC,22CQTYg2240s1ZB,366933.23,28,51370.652200000004,51370.652200000004,0.0,469674.5344,Being goods sold to Bumb PLC Inv No 235,0
2025-08-13,Bora-Prabhakar,11QeAtZ3849v4ZB,392766.92,18,35349.0228,35349.0228,0.0,463464.96559999994,Being goods sold to Bora-Prabhakar Inv No 780,0
2025-10-21,Menon-Rau,12HNmXK2881f6ZB,299011.63,12,0.0,0.0,35881.395599999996,334893.0256,Being goods sold to Menon-Rau Inv No 144,0
2025-07-25,Mander Ltd,12aVqbk1958H1ZC,19342.62,18,0.0,0.0,3481.6715999999997,22824.291599999997,Being goods sold to Mander Ltd Inv No 310,0
2026-02-01,Ganguly-Kohli,15UPQJu4507R6ZB,113377.43,12,6802.645799999999,6802.645799999999,0.0,126982.72159999999,Being goods sold to Ganguly-Kohli Inv No 398,0
2025-06-06,"Sinha, Borah and Sur",31huMKg2496j9ZA,489004.57,12,29340.2742,29340.2742,0.0,547685.1184,"Being goods sold to Sinha, Borah and Sur Inv No 804",0
2025-06-12,"Talwar, Balan and Din",10nctqU8384n7ZA,74049.93,28,0.0,0.0,20733.9804,94783.9104,"Being goods sold to Talwar, Balan and Din Inv No 868",0
2025-10-28,Sethi-Cherian,35FwPCO8713o3ZA,251997.7,12,0.0,0.0,30239.724000000002,282237.424,Being goods sold to Sethi-Cherian Inv No 378,0
2025-11-27,Jha PLC,12MuygG1011Y1ZC,326873.95,18,29418.6555,29418.6555,0.0,385711.261,Being goods sold to Jha PLC Inv No 748,0
2026-01-11,Tella Ltd,36qlwqE3855s8ZA,74662.32,28,10452.724800000002,10452.724800000002,0.0,95567.7696,Being goods sold to Tella Ltd Inv No 631,0
2026-02-16,Natt and Sons,11IAieP5901P2ZA,22342.53,28,3127.9542,3127.9542,0.0,28598.4384,Being goods sold to Natt and Sons Inv No 919,0
2025-05-11,"Barman, Rastogi and Sibal",27UUiYY1182S8ZB,21781.78,12,1306.9068,1306.9068,0.0,24395.5936,"Being goods sold to Barman, Rastogi and Sibal Inv No 688",0
2025-07-28,Munshi Group,20EVfNq1764U7ZA,243935.65,12,14636.139,14636.139,0.0,273207.928,Being goods sold to Munshi Group Inv No 335,0
2026-02-07,Personal - Sara,12ogoPY8183H7ZB,352747.95,18,31747.3155,31747.3155,0.0,416242.58100000006,Cash withdrawal,1
2025-10-18,Rau Inc,33wCUKo3540e4ZA,13232.92,12,0.0,0.0,1587.9504,14820.8704,Being goods sold to Rau Inc Inv No 334,0
2025-11-09,"Gulati, Bhattacharyya and Kumer",24lvacf3460y9ZC,169866.66,12,10191.9996,10191.9996,0.0,190250.65920000002,"Being goods sold to Gulati, Bhattacharyya and Kumer Inv No 628",0
2026-02-05,Hans-Venkatesh,24xpmQr5491z6ZC,374310.93,5,0.0,0.0,18715.5465,393026.4765,Being goods sold to Hans-Venkatesh Inv No 449,0
2025-08-03,Sankar LLC,27EZGrX5488U6ZA,371789.86,5,0.0,0.0,18589.493,390379.353,Being goods sold to Sankar LLC Inv No 609,0
2025-05-14,Dewan Ltd,16rKWvQ4813Q3ZA,397272.32,5,0.0,0.0,19863.616,417135.936,Being goods sold to Dewan Ltd Inv No 298,0
2025-06-30,Dalal-Pillay,35TTKvb3078U6ZB,346470.25,5,8661.75625,8661.75625,0.0,363793.76249999995,Being goods sold to Dalal-Pillay Inv No 703,0
2025-11-11,Johal Inc,35HzYNn3436s5ZB,495680.53,12,29740.8318,29740.8318,0.0,555162.1936000001,Being goods sold to Johal Inc Inv No 437,0
2025-07-20,"Murthy, Shah and Bhat",21iCXCe4917f5ZC,77939.74,5,1948.4935000000003,1948.4935000000003,0.0,81836.727,"Being goods sold to Murthy, Shah and Bhat Inv No 617",0
2025-07-03,Yadav Ltd,12qhPxO2807m2ZB,202699.41,5,0.0,0.0,10134.970500000001,212834.3805,Being goods sold to Yadav Ltd Inv No 771,0
2025-06-24,"Vala, Amble and Parikh",12zXjdA3050n8ZA,392251.8,0,0.0,0.0,0.0,392251.8,"Being goods sold to Vala, Amble and Parikh Inv No 911",0
2025-05-14,Pandit LLC,21UzWlJ8408f5ZB,34294.95,18,0.0,0.0,6173.090999999999,40468.041,Being goods sold to Pandit LLC Inv No 669,0
2025-04-20,"Brahmbhatt, Murty and Baria",32dOiOc7084B2ZB,333277.88,12,0.0,0.0,39993.3456,373271.2256,"Being goods sold to Brahmbhatt, Murty and Baria Inv No 699",0
2025-10-03,Pingle-Borah,17ddcsG6326X4ZC,319139.68,18,0.0,0.0,57445.1424,376584.8224,Being goods sold to Pingle-Borah Inv No 250,0
2025-06-21,Sandhu-Bakshi,34XlVqZ4237V7ZB,462234.56,18,41601.1104,41601.1104,0.0,545436.7808,Being goods sold to Sandhu-Bakshi Inv No 714,0
2025-07-13,Kumer-Sheth,14FsgON5167g9ZB,247190.09,0,0.0,0.0,0.0,247190.09,Being goods sold to Kumer-Sheth Inv No 291,0
2025-07-29,"Lal, Saraf and Sane",10LBqRN2717q2ZC,385080.79,0,0.0,0.0,0.0,385080.79,"Being goods sold to Lal, Saraf and Sane Inv No 742",0
2025-11-17,Wali-Devi,24WswRt6637Q9ZA,482573.55,5,12064.33875,12064.33875,0.0,506702.2275,Being goods sold to Wali-Devi Inv No 379,0
2025-08-26,Bedi-Kakar,13oqPCf2893D9ZB,327039.41,18,29433.546899999998,29433.546899999998,0.0,385906.5038,Being goods sold to Bedi-Kakar Inv No 994,0
2025-04-23,Mitra Group,24rOnWp4370k7ZC,132998.94,0,0.0,0.0,0.0,132998.94,Being goods sold to Mitra Group Inv No 784,0
2025-03-03,"Shetty, Barman and Doshi",29qalmK8982v3ZC,144120.42,28,20176.858800000005,20176.858800000005,0.0,184474.13760000005,"Being goods sold to Shetty, Barman and Doshi Inv No 572",0
2026-02-25,"Tailor, Halder and Tella",20UleLC0336L1ZC,225906.41,18,10165.78845,10165.78845,0.0,246237.9869,GST Calculation Error,1
2025-05-17,Murthy PLC,10EOxXb1276T5ZB,79918.37,18,7192.653299999999,7192.653299999999,0.0,94303.6766,Being goods sold to Murthy PLC Inv No 796,0
2025-09-09,Choudhary-Sandal,26VeJZc4635E4ZB,190860.99,28,0.0,0.0,53441.0772,244302.0672,Being goods sold to Choudhary-Sandal Inv No 202,0
2025-07-26,Majumdar-Chauhan,16xhFHr1768V9ZA,72677.65,18,6540.9884999999995,6540.9884999999995,0.0,85759.62700000001,Being goods sold to Majumdar-Chauhan Inv No 678,0
2025-06-29,"Raju, Handa and Purohit",17LXziL6901F3ZA,39937.22,28,5591.210800000001,5591.210800000001,0.0,51119.6416,"Being goods sold to Raju, Handa and Purohit Inv No 316",0
2025-07-01,"Shankar, Basu and Mahajan",12qeahb6162u9ZC,71025.91,5,0.0,0.0,3551.2955,74577.20550000001,"Being goods sold to Shankar, Basu and Mahajan Inv No 575",0
2026-01-25,Desai-Prakash,28uyEbT4019B8ZB,181083.35,12,10865.001,10865.001,0.0,202813.35199999998,Being goods sold to Desai-Prakash Inv No 311,0
2025-07-19,Bhardwaj and Sons,22OdKjE3616c6ZB,204817.8,12,0.0,0.0,24578.136,229395.936,Being goods sold to Bhardwaj and Sons Inv No 948,0
2025-03-31,Doshi Inc,21nnOGm3158J6ZC,462172.32,0,0.0,0.0,0.0,462172.32,Being goods sold to Doshi Inc Inv No 306,0
2025-03-26,"Aurora, Chatterjee and Wadhwa",11DcMea2971T7ZC,219490.57,5,0.0,0.0,10974.5285,230465.09850000002,"Being goods sold to Aurora, Chatterjee and Wadhwa Inv No 150",0
2025-11-15,"Mander, Rajagopal and Madan",15fhYgp8148N8ZB,41998.56,0,0.0,0.0,0.0,41998.56,"Being goods sold to Mander, Rajagopal and Madan Inv No 832",0
2025-08-16,Rao and Sons,38jvclC8941d1ZA,250962.55,5,6274.06375,6274.06375,0.0,263510.6775,Being goods sold to Rao and Sons Inv No 764,0
2025-09-08,"More, Chatterjee and Bhandari",14UMHTf0151c5ZB,128785.5,18,0.0,0.0,23181.39,151966.89,"Being goods sold to More, Chatterjee and Bhandari Inv No 523",0
2026-02-08,Naidu LLC,13lILKC3333A2ZB,163610.3,18,0.0,0.0,29449.853999999996,193060.15399999998,Being goods sold to Naidu LLC Inv No 788,0
2025-05-08,"Behl, Gandhi and Maharaj",20HJQPv0930a6ZA,475260.78,5,11881.519500000002,11881.519500000002,0.0,499023.819,"Being goods sold to Behl, Gandhi and Maharaj Inv No 601",0
2025-03-11,Bali PLC,27iwiXj5465Q9ZB,330354.1,0,0.0,0.0,0.0,330354.1,GST Calculation Error,1
2025-04-29,Sandal-Sekhon,31kLrYz0540P9ZB,457097.21,5,0.0,0.0,22854.860500000003,479952.07050000003,Being goods sold to Sandal-Sekhon Inv No 822,0
2025-04-02,Kant-Wagle,19IQsdh4614F7ZC,273163.86,0,0.0,0.0,0.0,273163.86,Being goods sold to Kant-Wagle Inv No 539,0
2025-08-01,Roy and Sons,35ASaKQ1582y3ZB,467226.94,5,11680.6735,11680.6735,0.0,490588.28699999995,Being goods sold to Roy and Sons Inv No 777,0
2025-09-08,"Mander, Bahri and Kadakia",11zLBdP7266q4ZA,223651.14,5,0.0,0.0,11182.557,234833.69700000001,"Being goods sold to Mander, Bahri and Kadakia Inv No 743",0
2025-05-22,Char PLC,36HCFqa7171m1ZC,113161.61,18,10184.544899999999,10184.544899999999,0.0,133530.6998,Being goods sold to Char PLC Inv No 350,0
2025-07-14,"Wason, Chada and Pall",32GPyCI7752o1ZA,54402.18,12,0.0,0.0,6528.2616,60930.4416,"Being goods sold to Wason, Chada and Pall Inv No 740",0
2025-06-30,Dube-Samra,17CGSQe9265c7ZA,284870.43,0,0.0,0.0,0.0,284870.43,Being goods sold to Dube-Samra Inv No 375,0
2026-02-22,"Buch, Sankaran and Agrawal",22EDNmz9574L8ZC,16388.47,12,983.3082,983.3082,0.0,18355.0864,"Being goods sold to Buch, Sankaran and Agrawal Inv No 125",0
2025-08-29,Gaba-Bora,34Spjbb9325l1ZB,227507.73,18,20475.6957,20475.6957,0.0,268459.1214,Being goods sold to Gaba-Bora Inv No 454,0
2025-10-03,Hari Inc,21aJfAQ0561Y9ZC,15146.13,12,0.0,0.0,1817.5356,16963.6656,Being goods sold to Hari Inc Inv No 288,0
2026-01-10,Kohli and Sons,36grWCM0184p1ZA,91447.92,0,0.0,0.0,0.0,91447.92,Being goods sold to Kohli and Sons Inv No 840,0
2025-08-08,"Iyer, Yadav and Wagle",25ilZBS6285C8ZC,369325.33,12,22159.519800000002,22159.519800000002,0.0,413644.36960000003,"Being goods sold to Iyer, Yadav and Wagle Inv No 728",0
2025-03-28,Dubey-Kata,14sHtJS3082Q6ZC,176065.98,18,0.0,0.0,31691.8764,207757.85640000002,Being goods sold to Dubey-Kata Inv No 686,0
2025-12-29,"Brahmbhatt, Padmanabhan and Viswanathan",20pUMdQ4068r8ZC,93880.69,12,5632.8414,5632.8414,0.0,105146.37280000001,"Being goods sold to Brahmbhatt, Padmanabhan and Viswanathan Inv No 781",0
2025-11-28,"Mitter, Kumar and Sharaf",21EiVje4815l6ZB,169244.27,28,0.0,0.0,47388.3956,216632.6656,"Being goods sold to Mitter, Kumar and Sharaf Inv No 609",0
